{
  "schemaVersion": 1,
  "app": "baan-chan-recipes",
  "exportedAt": "2026-10-17T14:00:00+07:00",
  "includesPhotos": true,
  "format": "zip",
  "recipes": [
    {
      "id": "d099dea5-37a6-50df-bdac-c315534ed33c",
      "title": "ข้าวผัดอกไก่",
      "category": "อาหารจานเดียว",
      "tags": [
        "ข้าวผัด",
        "อกไก่",
        "โปรตีนสูง",
        "น้ำมันน้อย"
      ],
      "prepMinutes": 10,
      "cookMinutes": 8,
      "servings": 1,
      "difficulty": "easy",
      "notes": "ประมาณ 450 กิโลแคลอรี/จาน (ข้าวสวย 200 ก. ≈ 260 + อกไก่ 100 ก. ≈ 130–165 + ไข่ 1 ฟอง ≈ 72 + น้ำมัน 1 ชช. ≈ 40 ; เทียบข้าวผัดไก่ร้านทั่วไป ~570 กิโลแคลอรี) (ค่าประมาณจากการรวมวัตถุดิบ ไม่ใช่ค่าที่ตรวจวัด) | แหล่งอ้างอิง: https://datanutri.com/foods/171477/chicken-broilers-or-fryers-breast-meat-only-cooked-roasted ; https://www.ocean.co.th/articles/calories-thai-food ; https://www.kindeediet.com/thai-food-calorie/ | เคล็ดลับ: (1) ใช้น้ำมันแค่ 1 ช้อนชาได้เพราะใช้กระทะร้อนจัดและข้าวแห้ง ถ้าข้าวติดกระทะให้เติมน้ำ 1 ช้อนโต๊ะแทนการเติมน้ำมัน ; (2) อย่าใส่ข้าวมากเกิน 250 ก. ต่อครั้ง ข้าวเยอะกระทะจะเย็นและข้าวจะนึ่งแทนที่จะผัด ; (3) เพิ่มผักได้ เช่น ถั่วลันเตา ข้าวโพดอ่อน เพื่อให้ได้ใยอาหาร | หมายเหตุภาพ: รูปขั้นตอนส่วนใหญ่เป็นภาพเทคนิค/วัตถุดิบที่ใช้ร่วมกันจาก Wikimedia Commons ไม่ใช่ภาพจากการทำสูตรนี้โดยตรง (ดู photo.match ของแต่ละขั้น)",
      "tips": [
        "ใช้น้ำมันแค่ 1 ช้อนชาได้เพราะใช้กระทะร้อนจัดและข้าวแห้ง ถ้าข้าวติดกระทะให้เติมน้ำ 1 ช้อนโต๊ะแทนการเติมน้ำมัน",
        "อย่าใส่ข้าวมากเกิน 250 ก. ต่อครั้ง ข้าวเยอะกระทะจะเย็นและข้าวจะนึ่งแทนที่จะผัด",
        "เพิ่มผักได้ เช่น ถั่วลันเตา ข้าวโพดอ่อน เพื่อให้ได้ใยอาหาร"
      ],
      "photo": {
        "path": "images/khao-pad-gai-cover.jpg",
        "mime": "image/jpeg",
        "credit": "Andy Li",
        "source": "https://commons.wikimedia.org/wiki/File:Khao_Pad_(Rosa%27s_Fried_Rice)_with_Chicken_-_Rosa%27s_Thai_2025-07-22.jpg",
        "license": "CC0",
        "licenseUrl": "http://creativecommons.org/publicdomain/zero/1.0/deed.en"
      },
      "photoCredit": "Andy Li",
      "photoSource": "https://commons.wikimedia.org/wiki/File:Khao_Pad_(Rosa%27s_Fried_Rice)_with_Chicken_-_Rosa%27s_Thai_2025-07-22.jpg",
      "photoLicense": "CC0",
      "sources": [
        "https://datanutri.com/foods/171477/chicken-broilers-or-fryers-breast-meat-only-cooked-roasted",
        "https://www.ocean.co.th/articles/calories-thai-food",
        "https://www.kindeediet.com/thai-food-calorie/"
      ],
      "ingredients": [
        {
          "name": "ข้าวสวยเย็น (ข้าวกล้องผสมข้าวขาว)",
          "amount": 200,
          "unit": "กรัม",
          "note": "ข้าวค้างคืนหรือพักให้เย็นจะร่วนไม่เละ"
        },
        {
          "name": "อกไก่ไม่ติดหนัง",
          "amount": 100,
          "unit": "กรัม"
        },
        {
          "name": "ไข่ไก่",
          "amount": 1,
          "unit": "ฟอง"
        },
        {
          "name": "กระเทียมสับ",
          "amount": 2,
          "unit": "กลีบ"
        },
        {
          "name": "แครอทหั่นเต๋าเล็ก",
          "amount": 2,
          "unit": "ช้อนโต๊ะ"
        },
        {
          "name": "ต้นหอมซอย",
          "amount": 1,
          "unit": "ต้น"
        },
        {
          "name": "น้ำมันรำข้าว",
          "amount": 1,
          "unit": "ช้อนชา"
        },
        {
          "name": "ซีอิ๊วขาว",
          "amount": 1,
          "unit": "ช้อนชา"
        },
        {
          "name": "น้ำปลา",
          "amount": 1,
          "unit": "ช้อนชา"
        },
        {
          "name": "พริกไทยป่น",
          "unit": "เล็กน้อย"
        }
      ],
      "steps": [
        {
          "text": "ตักข้าวสวยใส่ชามแล้วใช้ช้อนร่อนให้เม็ดข้าวแยกจากกัน ถ้าข้าวยังอุ่นให้พักไว้ 10–15 นาที ข้าวที่ผิวแห้งจะผัดแล้วร่วนและไม่เหนียวติดกระทะ"
        },
        {
          "text": "เลาะเส้นเอ็นและไขมันออกจากอกไก่ ตัดขวางเสี้ยนเป็นชิ้นหนาประมาณ 0.5 ซม. แล้วหั่นเป็นเต๋าเล็กขนาดประมาณเม็ดข้าวโพด ไก่ชิ้นเล็กจะสุกเร็วและไม่แห้ง",
          "photo": {
            "path": "images/khao-pad-gai-step-slice.jpg",
            "mime": "image/jpeg",
            "credit": "kakyusei",
            "source": "https://commons.wikimedia.org/wiki/File:Raw_chicken_slices.jpg",
            "license": "CC0",
            "licenseUrl": "http://creativecommons.org/publicdomain/zero/1.0/deed.en",
            "match": "technique"
          }
        },
        {
          "text": "หั่นแครอทเป็นเต๋าเล็ก ซอยต้นหอม แล้วสับกระเทียมให้ละเอียดพอประมาณ (ไม่ต้องบดเป็นเนื้อ) แยกใส่ถ้วยไว้ข้างเตา",
          "photo": {
            "path": "images/khao-pad-gai-step-garlic.jpg",
            "mime": "image/jpeg",
            "credit": "Betsssssy",
            "source": "https://commons.wikimedia.org/wiki/File:Chopping_garlic-01.jpg",
            "license": "CC BY 2.0",
            "licenseUrl": "https://creativecommons.org/licenses/by/2.0",
            "match": "technique"
          }
        },
        {
          "text": "ตอกไข่ใส่ถ้วย ตีเบา ๆ พอให้ไข่แดงแตกรวมกับไข่ขาว ปรุงด้วยพริกไทยนิดหน่อย พักไว้ข้างเตา",
          "photo": {
            "path": "images/khao-pad-gai-step-egg.jpg",
            "mime": "image/jpeg",
            "credit": "Mark Bonica",
            "source": "https://commons.wikimedia.org/wiki/File:Pre-omelet_eggs.jpg",
            "license": "CC BY 2.0",
            "licenseUrl": "https://creativecommons.org/licenses/by/2.0",
            "match": "technique"
          }
        },
        {
          "text": "ตั้งกระทะ (ควรเป็นกระทะเหล็กหรือเทฟลอน) ไฟกลางค่อนแรง ใส่น้ำมัน 1 ช้อนชา เมื่อกระทะร้อนจนเริ่มมีควันบางๆ ใส่กระเทียมผัดประมาณ 15 วินาทีให้หอมแต่ยังไม่ไหม้",
          "timerSeconds": 15
        },
        {
          "text": "ใส่ไก่และแครอท ผัดไฟแรงประมาณ 2–3 นาที ให้ไก่เปลี่ยนจากสีชมพูเป็นสีขาวทั้งชิ้น ตัดชิ้นใหญ่สุดดูข้างในต้องไม่มีสีชมพู แล้วดันไก่ไปขอบกระทะ",
          "timerSeconds": 150,
          "photo": {
            "path": "images/khao-pad-gai-step-wok.jpg",
            "mime": "image/jpeg",
            "credit": "Jvdc (Wikimedia Commons uploader)",
            "source": "https://commons.wikimedia.org/wiki/File:Wok_Cooking.jpg",
            "license": "CC BY-SA 2.0",
            "licenseUrl": "https://creativecommons.org/licenses/by-sa/2.0",
            "match": "technique"
          }
        },
        {
          "text": "เทไข่ลงกลางกระทะที่เว้นไว้ รอ 10 วินาทีให้ขอบไข่เริ่มเซ็ตแล้วจึงคุ้ยให้เป็นก้อนเล็ก ๆ จากนั้นใส่ข้าวลงไป ใช้ตะหลิวกดและตัดข้าวให้แตกออก ผัดไฟแรง 2 นาทีจนเม็ดข้าวกระโดดและร้อนทั่วกัน",
          "timerSeconds": 120
        },
        {
          "text": "ปรุงรสด้วยซีอิ๊วขาวและน้ำปลาโดยเทรอบขอบกระทะ (จะหอมไหม้เล็กน้อย) คลุกอีก 30 วินาที โรยต้นหอม ชิมแล้วปิดไฟ เสิร์ฟพร้อมแตงกวาและมะนาวทันที",
          "timerSeconds": 30
        }
      ],
      "createdAt": "2026-10-17T14:00:00+07:00",
      "updatedAt": "2026-10-17T14:00:00+07:00"
    },
    {
      "id": "b521fbf4-7d0f-51e6-9ea4-370e3dff236d",
      "title": "ข้าวกะเพราไก่ไม่ใช้น้ำมัน",
      "category": "อาหารจานเดียว",
      "tags": [
        "กะเพรา",
        "ไก่",
        "ไม่ใช้น้ำมัน",
        "เผ็ด",
        "โปรตีนสูง"
      ],
      "prepMinutes": 10,
      "cookMinutes": 6,
      "servings": 1,
      "difficulty": "easy",
      "notes": "ประมาณ 430 กิโลแคลอรี/จาน (ข้าวสวย 200 ก. ≈ 260 + อกไก่สับ 120 ก. ≈ 130 + ถั่วฝักยาว/ซอสปรุง ≈ 40 ; ไม่รวมไข่ดาว ถ้าเพิ่มไข่ต้ม 1 ฟอง +70 ; ข้าวราดกะเพราไก่ร้านทั่วไป ~573) (ค่าประมาณจากการรวมวัตถุดิบ ไม่ใช่ค่าที่ตรวจวัด) | แหล่งอ้างอิง: https://datanutri.com/foods/171477/chicken-broilers-or-fryers-breast-meat-only-cooked-roasted ; https://www.ocean.co.th/articles/calories-thai-food | เคล็ดลับ: (1) การใช้น้ำแทนน้ำมันทำให้กระเทียมไหม้ง่ายกว่า คุมไฟกลางและอย่าทิ้งกระทะ ; (2) ถ้าอยากได้ไข่ดาวแบบไม่ใช้น้ำมัน ให้ใช้ไข่ต้มยางมะตูมหรือไข่ลวก ; (3) เพิ่มความอิ่มด้วยข้าวกล้องและผักสดข้างจาน | หมายเหตุภาพ: รูปขั้นตอนส่วนใหญ่เป็นภาพเทคนิค/วัตถุดิบที่ใช้ร่วมกันจาก Wikimedia Commons ไม่ใช่ภาพจากการทำสูตรนี้โดยตรง (ดู photo.match ของแต่ละขั้น)",
      "tips": [
        "การใช้น้ำแทนน้ำมันทำให้กระเทียมไหม้ง่ายกว่า คุมไฟกลางและอย่าทิ้งกระทะ",
        "ถ้าอยากได้ไข่ดาวแบบไม่ใช้น้ำมัน ให้ใช้ไข่ต้มยางมะตูมหรือไข่ลวก",
        "เพิ่มความอิ่มด้วยข้าวกล้องและผักสดข้างจาน"
      ],
      "photo": {
        "path": "images/kra-pao-gai-cover.jpg",
        "mime": "image/jpeg",
        "credit": "PattayaPatrol",
        "source": "https://commons.wikimedia.org/wiki/File:DFC_0804_A_plate_of_steamed_white_rice_topped_with_a_runny_fried_egg_served_alongside_stir-fried_minced_chicken_with_basil_and_sliced_cucumber.jpg",
        "license": "CC BY-SA 4.0",
        "licenseUrl": "https://creativecommons.org/licenses/by-sa/4.0"
      },
      "photoCredit": "PattayaPatrol",
      "photoSource": "https://commons.wikimedia.org/wiki/File:DFC_0804_A_plate_of_steamed_white_rice_topped_with_a_runny_fried_egg_served_alongside_stir-fried_minced_chicken_with_basil_and_sliced_cucumber.jpg",
      "photoLicense": "CC BY-SA 4.0",
      "sources": [
        "https://datanutri.com/foods/171477/chicken-broilers-or-fryers-breast-meat-only-cooked-roasted",
        "https://www.ocean.co.th/articles/calories-thai-food"
      ],
      "ingredients": [
        {
          "name": "อกไก่สับหยาบ",
          "amount": 120,
          "unit": "กรัม"
        },
        {
          "name": "ใบกะเพรา",
          "amount": 1,
          "unit": "ถ้วย",
          "note": "ใส่แบบหลวม ๆ"
        },
        {
          "name": "กระเทียม",
          "amount": 4,
          "unit": "กลีบ"
        },
        {
          "name": "พริกขี้หนูสวน",
          "amount": 4,
          "unit": "เม็ด",
          "note": "ปรับตามความเผ็ด"
        },
        {
          "name": "ถั่วฝักยาวซอยท่อนสั้น",
          "amount": 3,
          "unit": "ฝัก"
        },
        {
          "name": "น้ำปลา",
          "amount": 1,
          "unit": "ช้อนชา"
        },
        {
          "name": "ซีอิ๊วขาว",
          "amount": 1,
          "unit": "ช้อนชา"
        },
        {
          "name": "ซอสหอยนางรม",